{
  "id": "urn:ngsi-ld:Waste:barcelona-eixample-waste-20260920-0042",
  "type": "Waste",
  "dateCreated": "2026-09-20T06:30:00Z",
  "dateModified": "2026-09-22T14:00:00Z",
  "source": "https://example.org/waste-management/waste/20260920-0042",
  "dataProvider": "AjuntamentDeBarcelona",
  "isProducedBy": [
    "urn:ngsi-ld:WasteProducer:bcn-eixample-household-00042"
  ],
  "isDepositedIn": "urn:ngsi-ld:Container:barcelona-eixample-0042",
  "isDepositedAt": "urn:ngsi-ld:WasteProcessingSite:bcn-south-plant-01",
  "becomes": "urn:ngsi-ld:SecondaryRawResource:compost-batch-2026-0920",
  "isProcessedBy": [
    "urn:ngsi-ld:WasteProcessingDevice:composter-bcn-south-03"
  ],
  "isCollectedDuring": "urn:ngsi-ld:Journey:eixample-round-20260920-am",
  "processingBeginsOn": "2026-09-21",
  "processingEndsOn": "2026-09-25",
  "hasCollectionDate": "2026-09-20",
  "wasteKind": "PaperCardboardWaste"
}
